{
  "litVersion": "0.1.0",
  "project": "https://example.org/lit/small-constellations",
  "agents": [
    {
      "id": "person:iko-reed",
      "type": "person",
      "name": "Iko Reed"
    },
    {
      "id": "person:ana-ortiz",
      "type": "person",
      "name": "Ana Ortiz"
    },
    {
      "id": "person:theo-north",
      "type": "person",
      "name": "Theo North"
    }
  ],
  "activities": [
    {
      "id": "activity:draft-paper-moon",
      "type": "creation",
      "agentIds": [
        "person:ana-ortiz"
      ],
      "outputs": [
        "work:paper-moon"
      ],
      "startedAt": "2026-03-02T10:00:00Z",
      "humanReviewed": true
    },
    {
      "id": "activity:draft-static",
      "type": "creation",
      "agentIds": [
        "person:theo-north"
      ],
      "outputs": [
        "work:after-the-static"
      ],
      "startedAt": "2026-03-11T14:00:00Z",
      "humanReviewed": true
    },
    {
      "id": "activity:anthology-edit",
      "type": "editing",
      "agentIds": [
        "person:iko-reed"
      ],
      "inputs": [
        "work:paper-moon",
        "work:after-the-static"
      ],
      "outputs": [
        "https://example.org/lit/small-constellations"
      ],
      "startedAt": "2026-04-20T09:00:00Z",
      "endedAt": "2026-05-08T17:00:00Z",
      "humanReviewed": true
    }
  ]
}
